source,title,content,date
CNN,Analysis: Trump’s plan to radically remake government with RFK Jr. and Elon Musk is coming into view | CNN Politics,"A version of this story appeared in CNN’s What Matters newsletter. To get it in your inbox, sign up for free here.
For much of the presidential campaign, former President Donald Trump worked to distance himself from Project 2025, the detailed game plan written by conservative activists for a second Trump term.
Whether or not his allies will try to implement portions of the controversial plan if he wins the 2024 election is still the topic of some debate.
But there is an equally radical and expansive government reformation plan coming out of Trump’s own mouth, in which heterodox figures like Robert F. Kennedy Jr. would be given free rein to “go wild” on the health safety system and Elon Musk would be enabled to, as the tech billionaire said, “start from scratch” with the federal workforce.
So without getting bogged down in whether Trump does or does not support Project 2025, here’s a look at what the former president and the people he says he would empower have said they would do if he wins the White House.
‘Go wild’ with RFK Jr.
Trump has promised to give Kennedy leeway to remake the way the government health apparatus protects Americans.
“I’m going to let him go wild on the food. I’m going to let him go wild on the medicines,” Trump said during his closing argument rally at Madison Square Garden on Sunday.
Much of what Kennedy pushes sounds positive. His “Make America Healthy Again” PAC promises to focus on “prioritizing regenerative agriculture, preserving natural habitats, and eliminating toxins from our food, water, and air.”
But those ideas are short on specifics, and there are personal issues that would impede anyone else from government service. Kennedy compared vaccine requirements with the Nazi Germany era, claiming Anne Frank was in a better situation; was once arrested for heroin possession; and has pushed wild conspiracy theories about chemicals in the water making children gay or transgender.
Kennedy’s own health has also been a concern. He once ate so much tuna and perch that he experienced “severe brain fog” from mercury poisoning, he told The New York Times.
In video obtained by CNN, Kennedy told supporters on Monday that Trump had promised to give him sweeping power over multiple agencies if the former president wins the election.
“The key that I think I’m – you know, that President Trump has promised me is – is control of the public health agencies, which are HHS (Department of Health and Human Services) and its sub-agencies, CDC (Centers for Disease Control and Prevention), FDA (Food and Drug Administration), NIH (National Institutes of Health) and a few others, and then also the USDA (Department of Agriculture), which is – which, you know, is key to making America healthy. Because we’ve got to get off of seed oils, and we’ve got to get off of pesticide intensive agriculture,” Kennedy said.
CNN has reached out to the Trump campaign for comment, according to a report by Aaron Pellish. So it’s not clear if Trump’s “go wild” is the same as Kennedy’s view that he would be given such broad control. Trump has definitely said Kennedy would be included on a panel to investigate the rise in chronic diseases. For what it’s worth, Project 2025 suggested a massive overhaul of health agencies, including splitting up the CDC.
“Trump’s plans have been met with alarm in the public health community, not so much for the specific policy proposals Kennedy has communicated as part of his ‘Make America Healthy Again’ platform as much as for the key issue he’s been leaving out: vaccines,” according to CNN’s Meg Tirell. She wrote an in-depth review of Kennedy’s record on health issues.
Both Trump and Kennedy have expressed vaccine skepticism, and Kennedy has been a longtime activist pushing debunked theories about vaccines. During the campaign, Kennedy has deemphasized his views on vaccines, Tirrell notes. His push for more natural food does find support among some health experts.
‘Start from scratch’ with Musk
Musk, the superrich Trump supporter, would be given a much wider portfolio than Kennedy and be charged with a massive downsizing of the federal government.
It’s an even stickier situation since Musk’s many companies, including SpaceX and Tesla, have a profit-motivated interest in business with the government. The US government currently relies on SpaceX, which also owns the satellite internet provider Starlink.
If there’s any doubt that a Musk government role could be a risk for conflict of interest, simply look at the fact that he has said he could be in charge of the “Department of Government Efficiency.” DOGE is the name of Musk’s cryptocurrency, an area the Trump family is also keen to enter.
Musk is also constantly pushing out antisemitic things and has mused about how women shouldn’t vote. Not to mention reports of his meetings with hostile foreign leaders.
In a potential new Trump administration, Musk promises a reinvention of the federal bureaucracy.
“Let’s start from scratch,” Musk said at an event in October in Pittsburgh, suggesting a drastic remaking of the federal bureacracy.
CNN’s David Goldman looked this month at what Trump and Musk have said about a potential Musk role in government, which would be focused on steep spending cuts – Musk has said he could trim $2 trillion, perhaps with help from artificial intelligence – and rolling back regulations. But he’d do it in a nice way, apparently.
“Musk has promised a gentle touch, offering generous severance packages to laid-off government workers, while at the same time proposing an assessment system that threatens layoffs to wasteful employees,” Goldman wrote.
The problem, according to the former Treasury Secretary Larry Summer, is that there’s not $2 trillion to be gained from massive government layoffs.
“Respectfully, I think it is idiotic,” Summers said on Fox News this week. “These people think it’s like some business. But here’s the problem: Only 15% of the federal budget is for payroll. So even if you took all the employees, every single person working for the federal government out, you couldn’t save anything like $2 trillion.”
Summers has a point about payroll. The government spent about $271 billion to compensate 2.3 million civilian employees in 2022, according to the Congressional Budget Office.
Summers said that to achieve trillions in cuts, Musk would have to look at Social Security and Medicare benefits, something Trump has promised not to do.
‘No Obamacare’
House Speaker Mike Johnson, a top Trump ally, said in Pennsylvania on Monday that if Trump wins and Republicans keep the House, there would be a “massive” overhaul of the health care system. “No Obamacare?” shouted an attendee at the campaign event. “No Obamacare,” Johnson said.
He added: “The ACA is so deeply ingrained; we need massive reform to make this work. And we got a lot of ideas on how to do that.”
During a debate with Vice President Kamala Harris in September, Trump did not give specifics, but he did say he had “concepts” of a plan. These have not been shared publicly.
Trump tried, and failed, during his time in White House to repeal the Affordable Care Act, but retooling the health care system is clearly still a priority for Republicans.
Drastic change won’t be easy
This is a good spot to point out that no matter what Trump is promising Kennedy and Musk, and no matter what Johnson hopes to do about health care, the realities of the US government make drastic change hard to achieve.
A minority in the Senate, assuming it’s larger than 40 senators, could block any attempt to really undo the Affordable Care Act. The Senate is supposed to confirm top officials like Cabinet secretaries, although Trump and other presidents found ways around that rule in the Constitution. It’s not clear if Kennedy could find the votes to be confirmed as secretary of Health and Human Services or if Trump would even nominate him. If Kennedy had a role in the White House, his ability to enact sweeping change would be limited.
While presidents have authority over the federal workforce and Trump was working to reclassify many federal employees to make them easier to fire when he was president, a “start from scratch” scenario would theoretically require congressional approval.
Not that we can say with any certainty what would require congressional approval since, unlike with the detailed Project 2025 plan, there are no specifics to match any of these big ideas. At least not yet.",30/10/2024
CNN,Supreme Court rules RFK Jr. will appear on battleground ballots despite suspending campaign | CNN Politics,"The Supreme Court declined Tuesday to let Robert F. Kennedy Jr. withdraw his name from ballots in Michigan and Wisconsin, battleground states where votes for his now suspended campaign could cut into support for former President Donald Trump.
Kennedy, who left the presidential race in August and endorsed Trump, urged the Supreme Court in an emergency appeal to force the states to yank his name from the ballots. But state election officials countered that early and absentee voting in the states was already well underway. In other words, they said, it was too late.
The Supreme Court handed down its decision without further explanation, which is common on its emergency docket. Justice Neil Gorsuch, a member of the court’s conservative wing, dissented in the Michigan case.
In an unusual twist, Kennedy had asked the high court weeks earlier to help him push his way onto the ballot in New York. After suspending his campaign, Kennedy initially suggested voters could continue to support him in less competitive states. The Supreme Court also rejected that request.
At the center of Kennedy’s case in Michigan and Wisconsin was an argument that the states were violating his First Amendment rights by compelling his speech by forcing him to suggest to voters that he is still a candidate.
Michigan told the Supreme Court this week that over 1.5 million voters had already returned absentee ballots with Kennedy’s name listed as an option on them and that another 263,000 residents had voted early.
“This election is not merely ‘imminent,’ it is already underway, and voters are already voting,” Michigan officials had told the Supreme Court.",29/10/2024
CNN,Supreme Court allows Virginia to purge suspected noncitizens from voter registration rolls | CNN Politics,"A divided Supreme Court on Wednesday allowed Virginia to implement a program that state officials say is aimed at removing suspected noncitizens from its voter registration rolls, siding with Republicans in one of its first significant decisions tied to next week’s election.
The decision, issued without comment from a majority of conservative justices, will allow the state to keep off the rolls certain voters it suspects of being noncitizens.
Liberal Justices Sonia Sotomayor, Elena Kagan and Ketanji Brown Jackson dissented.
Republicans, including former President Donald Trump, framed the effort in Virginia as a commonsense way of ensuring noncitizens don’t vote. But the Biden administration, voting rights groups and lower courts said Virginia’s program also ensnared – and potentially disenfranchised – an unknown number of citizens.
Even though Virginia isn’t a battleground state, both the program and the legal fight took on sharply political overtones as Trump and other Republicans have fueled false narratives about widespread voting by noncitizens. At issue are about 1,600 voter registrations that Virginia said came from self-identified noncitizens but that a US District Court said hadn’t been fully vetted for citizenship status.
Noncitizens are not allowed to vote in federal elections; none of the lower court rulings had changed that fact.
Trump and other Republicans have seized on claims of illegal voting and that was part of the argument they made to explain the former president’s loss in 2020. But documented cases of noncitizens voting are extremely rare. A recent Georgia audit of the 8.2 million people on its rolls found just 20 registered noncitizens – only nine of whom had voted.
The Virginia case began with an order signed by Virginia Gov. Glenn Youngkin, a Republican, in August that required election officials to take more aggressive steps to match residents who self-identified as noncitizens at the Department of Motor Vehicles against voter rolls and to purge those matches.
Youngkin on Wednesday called the Supreme Court’s order a “victory for common sense and election fairness.”
The state’s voters, he said, “can cast their ballots on Election Day knowing that Virginia’s elections are fair, secure, and free from politically-motivated interference.”
The Biden administration and voting rights groups sued and a US District Court concluded last week that at least some eligible US citizens had their registrations culled under the program. District Judge Patricia Tolliver Giles said that none of the parties involved in the case knew for certain the citizenship status of the purged voters because the information wasn’t verified.
Those opposed to the program relied on a 1993 law, the National Voter Registration Act, which bars states from making “systematic” changes to voting rolls with 90 days of a federal election. The Biden administration said that Youngkin’s order created exactly that kind of systematic program within the so-called “quiet period” mandated by the federal law.
Virginia argued that the quiet period prohibitions applied only to eligible voters, not noncitizens.
None of the lower court orders blocked the state from making individual eligibility assessments, or from ultimately knocking noncitizen voters off the rolls, nor gave noncitizens the right to vote in federal elections. The federal law only bars “systematic” changes.
A three-judge panel of the 4th US Circuit Court of Appeals – all appointed by Democratic presidents – affirmed most of Giles’ ruling, keeping the program paused and required the state to return the 1,600 registrants to the rolls.
In their emergency appeal to the Supreme Court, Virginia election officials relied in part on a still-developing legal theory that warns federal courts against making last-minute changes to the status quo of voting rules before an election. The so-called “Purcell principle” is intended to stop federal courts from getting dragged into last-minute election controversies.
Virginia argued that the federal district court violated that principle by pausing the program. Voting rights groups countered that there was a federal law in play in this instance that specifically allowed plaintiffs to challenge last-minute voting changes.
Lawyers for Virginia also pointed to its option for same-day registration. Those whose registrations were wrongly cancelled could re-register at an in-person polling place by affirming their citizenship.
Virginia’s opponents countered that that option would not solve the issue for purged voters who planned to vote absentee, unaware their registrations had been cancelled and that it risked confusion at polling places – particularly if poll workers weren’t adequately prepared to deal with the scenario.
Because the Supreme Court offered no explanation for its decision, it’s not clear which of Virginia’s arguments were persuasive.
This story has been updated with additional details.
CNN’s Tierney Sneed contributed to this report.",30/10/2024
CNN,Judge rejects GOP congressmens’ lawsuit challenging vetting process for Pennsylvania overseas ballots | CNN Politics,"A federal judge on Tuesday tossed out a Republican lawsuit that sought to segregate overseas ballots in Pennsylvania for additional vetting.
US District Judge Christopher Conner said that the challengers to Pennsylvania’s policies for overseas ballots filed by GOP members of the Pennsylvania congressional delegation and an outside group came too late and that it was too close to the election for a court to intervene.
The overseas vote has long been viewed as sacrosanct because of its connection to the military vote, and the Pennsylvania lawsuit – which would have jeopardized the ballots of service people abroad – drew a sharp backlash.
In recent election cycles, the civilian expat community has outnumbered military voters casting ballots. Democrats have touted their effort to turn out their voters abroad.
Tuesday’s ruling comes on the heels of court losses for Republicans in Michigan and North Carolina in Republican National Committee lawsuits that challenged overseas ballots cast by voters who had never lived in those states but were eligible to vote because of familial ties to those states. Those cases have been appealed, but the Michigan appeal will not be resolved before the election.
Conner said that the court order that Republicans were asking for was a “nonstarter.”
“An injunction at this late hour would upend the Commonwealth’s carefully laid election administration procedures to the detriment of untold thousands of voters, to say nothing of the state and county administrators who would be expected to implement these new procedures on top of their current duties,” Conner, who was appointed by President George W. Bush, said.
“Plaintiffs delayed too long to file their action, they lack standing, they have failed to join indispensable parties, and they have failed to articulate a viable cause of action,” Conner added.
He cited other procedural issues with Republicans’ lawsuit as well.
A lawyer for the House Republicans did not immediately respond to a request for comment.
Pennsylvania election officials said in court filings that the lawsuit “would potentially disenfranchise thousands of voters who are qualified to vote under Pennsylvania law.” At a court hearing earlier this month, a lawyer for the election officials said that by the time the complaint had been filed, 26,000 overseas ballots had been requested in Pennsylvania. It’s not clear how many would have been rejected under the more stringent verification procedures Republicans were seeking.
In the Pennsylvania case, the Republicans were arguing that election officials should take additional steps to verify ballots cast in the state from overseas voters.
Correction: This story has been updated to reflect the judge who ruled in the case is Judge Christopher Conner.",29/10/2024
