source,title,content,date
CNN,RFK Jr. said Trump promised him ‘control’ of HHS and USDA | CNN Politics,"Robert F. Kennedy Jr. told supporters on Monday that former President Donald Trump has promised to give him “control” of several public health agencies, including the US Department of Health and Human Services and the US Department of Agriculture, if he wins a second term in November.
Kennedy, who suspended his independent presidential campaign in August and endorsed Trump, said during a livestreamed organizing event that Trump told him he’d oversee a vast public health portfolio if the former president returns to the White House, and added that he’d prioritize his agenda for “making America healthy.”
“The key that I think I’m – you know, that President Trump has promised me is – is control of the public health agencies, which are HHS and its sub-agencies, CDC, FDA, NIH and a few others, and then also the USDA, which is – which, you know, is key to making America healthy. Because we’ve got to get off of seed oils, and we’ve got to get off of pesticide intensive agriculture,” Kennedy said, according to video of the event obtained by CNN.
CNN has reached out to the Trump campaign for comment.
Trump has previously told CNN he would consider appointing Kennedy to a role in a potential second administration. Following Kennedy’s endorsement in August, Trump committed to including Kennedy on a panel that would investigate the rise in diagnoses of chronic diseases should he return to the White House. Kennedy serves on Trump’s transition team and has been campaigning as a surrogate for him in key battleground states since exiting the presidential race.
On Sunday, Trump said during a campaign rally in New York that he would let Kennedy “go wild on food” and “go wild on medicines” if he wins in November.
Kennedy has been one of the leading proponents of anti-vaccine conspiracy theories in the United States. He made false attacks on the safety and efficacy of vaccines and sharp criticisms of public health and agriculture policy a centerpiece of his presidential campaign.
CNN’s Kate Sullivan contributed to this report.",29/10/2024
CNN,Trump floats ending the federal income tax. Here’s what that would mean | CNN Politics,"After promising to eliminate taxes on tips, Social Security benefits and overtime pay, former President Donald Trump is taking aim at the largest levy of them all — the federal income tax.
With Election Day around the corner, Trump talked about his interest in ending the federal income tax in two high-profile interviews this week, harking back to the late 19th century, when the US relied on tariffs to fund federal spending. The former president has vowed to broadly impose tariffs, arguing they can generate trillions of dollars in revenue.
Speaking with barbers in the Bronx, New York, in a segment aired on Fox News on Monday, Trump said, “There is a way, if what I’m planning comes out.”
“When we were a smart country, in the 1890s … this is when the country was relatively the richest it ever was. It had all tariffs. It didn’t have an income tax,” Trump said after a barber asked whether it would be possible to jettison the federal income tax. “Now we have income taxes, and we have people that are dying. They’re paying tax, and they don’t have the money to pay the tax.”
A few days later, podcaster Joe Rogan asked Trump whether he was serious about replacing federal income taxes with tariffs.
“Yeah, sure, why not?” Trump said during his interview Friday on “The Joe Rogan Experience.”
Trump, who also floated the idea of ending the federal income tax in June, has not said whether he would eliminate federal corporate income and payroll taxes or just the individual income tax — which raises about half of the nearly $5 trillion in revenue that the federal government collects.
By contrast, tariffs bring in about 2% of federal revenue.
Eliminating the income tax could be a future “aspirational goal,” Trump campaign senior adviser Jason Miller told reporters Saturday, noting that the former president’s top priorities would be extending the expiring provisions of his 2017 Tax Cuts and Jobs Act and implementing the targeted tax cuts that Trump has rolled out.
‘Mathematically impossible’
Sweeping tariffs are a cornerstone of Trump’s economic platform for a second term, if he is elected. He has called for an across-the-board tariff of either 10% or 20% on all imports into the US, as well as a tariff upward of 60% on all Chinese imports.
The former president argues that tariffs, which he imposed to a lesser extent during his first term, would pay for his pricey array of proposals. He has repeatedly denied that American consumers would bear the brunt of the tariffs, inaccurately claiming that foreign countries would pay the levies.
Many federal budget experts, however, have poured cold water on the notion that tariffs could replace income taxes.
“It’s an absurd idea for many reasons, the biggest being that it is mathematically impossible to replace the income tax with tariffs,” Erica York, senior economist and research director at the right-leaning Tax Foundation, told CNN. “Imports are a much smaller tax base than taxable income, and there’s no way to squeeze enough revenue from taxing imports to fully replace taxing income. A swap like this would hike taxes on working-class taxpayers and invite harmful retaliation against US exports.”
Increasing tariffs would likely prompt Americans to purchase fewer imported goods, canceling out at least part of the hoped-for revenues, Brian Riedl, a senior fellow at the right-leaning Manhattan Institute, told CNN.
“At first blush, fully replacing $2.4 trillion in income taxes would require a 75% tariff on America’s $3.2 trillion in annual imports,” he said. “However, even that unrealistically assumes that Americans continue purchasing the same imports at nearly double the price.”
What’s more, Trump had to spend part of the revenue raised from the tariffs he imposed in his first term bailing out industries, including agriculture, that were hurt by other nations’ retaliatory actions, Riedl said.
“So even the new revenues from Trump’s next round of tariffs may not provide much net budget savings,” he continued.
Even without eliminating the federal income tax, Trump’s economic package would increase the national debt by $7.5 trillion over a decade, according to a recent analysis by the Committee for a Responsible Federal Budget. The nonpartisan watchdog group estimates that his tariffs proposal would bring in $2.7 trillion over 10 years.",26/10/2024
CNN,Democratic divisions over Israel heat up over Gaza hospital blast controversy | CNN Politics,"Democrats on Capitol Hill are furious over Michigan Rep. Rashida Tlaib’s refusal to retract or add new context to her statements blaming Israel for the deadly blast that devastated a Gaza hospital, killing hundreds of people and setting off a regional backlash against the US and Israel.
Tlaib’s initial social media posts reflected the early Hamas-sourced reports out of Gaza. But those reports are now at odds with initial American intelligence, which subsequently concluded that the Israel Defense Forces were not responsible for the explosion.
The dispute has laid bare long-standing and increasingly passionate disagreements among congressional Democrats over the party’s relationship with Israel – and, now, how to position the party as the deadly conflict in Israel and Gaza escalates.
Mainstream Democrats, led by President Joe Biden, continue to insist on staunch support for Israel, while some progressive House members are becoming more insistent that the US aggressively push for a ceasefire and hold Israel accountable for alleged war crimes against Palestinians. And within the progressive bloc too, high-profile members such as New York Rep. Alexandria Ocasio-Cortez have occasionally diverged, at least rhetorically, from their ideological allies and have spoken in more cautious, conciliatory tones. The political director for Rep. Ro Khanna, another influential progressive, resigned because the California Democrat did not sign a resolution calling for a ceasefire.
Tlaib, a Palestinian American and a longtime advocate for Palestinian rights, has been the most outspoken critic of Israel in Congress since her election in 2018. Her insistence on blaming Israel for the blast, which the US believes was struck by an errant rocket launched by extremist group Islamic Jihad, has roiled colleagues determined to present a united front at a harrowing time.
“That’s a vile position to take,” Florida Rep. Debbie Wasserman Schultz told CNN, suggesting that Tlaib should review intelligence made available to House members. “She should at least pull those tweets down, instead of remaining entrenched in a position that is dangerous and unacceptable.”
Democrats have mostly been measured in their public comments about Tlaib, expressing frustration with her unyielding position in light of the conflicting reports and new evidence that Israel was not responsible for the hospital blast while also blaming the media over its coverage of the tragedy.
“When Israel makes statements, they have to show satellite imagery and all sorts of video. But when Hamas says something, the entire media world ran with it.” Florida Rep. Jared Moskowitz said. “It caused riots in all sorts of countries. It caused meetings to be canceled for the president. And so everyone has to be careful before they just react, and wait for things to be confirmed.”
But the effort to project unity could soon become untenable – and the divisions are becoming more personal.
According to a source with knowledge of the complaints, some Jewish Democrats have privately complained to Minority Leader Hakeem Jeffries’ team about comments from Tlaib and Minnesota Rep. Ilhan Omar, who initially echoed reports blaming Israel for the hospital attack before posting additional context about the hospital explosion and acknowledging the US intelligence assessment. (Jeffries has embraced the US and Israeli intelligence conclusions and a spokesperson said in a statement that Jeffries, like Biden, backs Israel’s “unequivocal right to defend itself against Hamas under the established rules of war and strongly disagrees with any effort to blame President Joe Biden or the policies of his administration.”)
Tlaib’s office did not respond to a request for comment on the matter, but the Michigan Democrat appeared at a Wednesday rally on Capitol Hill and continued to blame Israel.
“That’s what’s been really painful – just continue to watch people think it’s OK to bomb a hospital, where children,” Tlaib said. “What’s so hard sometimes is watching those videos and the people telling the kids, ‘Don’t cry.’ But like, let them cry. And they’re shaking, and somebody – you know this – they keep telling them not to cry in Arabic. They can cry, I can cry, we all can cry. If we’re not crying, something is wrong.”
“People are furious,” one House Democrat told CNN about the reaction to Tlaib’s comments. “The intelligence that we’ve received is clear. Do you believe Hamas’ intel or do you believe the United States’ intelligence?”
There’s now a push among some House Democrats to convince Tlaib to get an intelligence briefing on the hospital strike, according to the source.
Another House Democrat felt that Tlaib’s comments were frustrating but not entirely unexpected and that her colleagues are taking different approaches to addressing them. Some have been speaking out publicly while others are giving Tlaib space to walk back her comments.
Some Democrats pointed to a social media post by Pennsylvania Sen. John Fetterman as summing up the way a lot of them are feeling right now.
“It’s truly disturbing that Members of Congress rushed to blame Israel for the hospital tragedy in Gaza,” Fetterman wrote. ” Who would take the word of a group that just massacred innocent Israeli citizens over our key ally?”
Another Democratic aide, though, argued that the pushback against Tlaib and Omar undermined the Democratic Party’s brand.
“Part of being a ‘diversity party’ and a ‘big tent party’ includes bringing new voices who have been marginalized into the party,” the aide said. “And Muslim Americans have been some of the most marginalized people in American life for the past two decades.”
“No one in Congress is denying the horror of Hamas or the horror of the thousands of Israelis killed and the largest attack on Jews since the Holocaust,” the aide said, adding that the frustration among Muslim Americans – and some Jewish Americans – lies in “one side with very little political power receiving all of the outrage.”
Former House Majority Leader Steny Hoyer, a Maryland Democrat, downplayed the discord in the caucus.
“Name me more than four people,” Hoyer told CNN, in an apparent reference to the original “squad” of Tlaib, Omar, Ocasio Cortez and Massachusetts Rep. Ayanna Pressley. “Do we have some people that have a different view? We do. But it’s not the position of the party.”
But the ranks of the dissenters have grown since then-House Speaker Nancy Pelosi first offered a similarly dismissive assessment of the squad members in 2019. Progressives now make up a growing share of the House Democratic Caucus. More than a dozen Democratic members have so far publicly called for a ceasefire, including those who signed a proposed resolution by Missouri Rep. Cori Bush, a newer squad member.
“I am grieving for every Palestinian, Israeli, and American life lost to this violence, and my heart breaks for all those who will be forever traumatized because of it,” Bush said in an accompanying statement. “War and retaliatory violence doesn’t achieve accountability or justice; it only leads to more death and human suffering.”",20/10/2023
CNN,Donald Trump campaign manager shared posts in 2021 saying Trump’s lies caused the violence on January 6 | CNN Politics,"In the immediate aftermath of the January 6, 2021, attack on the US Capitol, a number of conservatives and Republicans broke ranks with then-President Donald Trump and blamed him for the violence that day. Among them was Trump’s current campaign manager, Chris LaCivita.
In a series of reposts on X – formerly Twitter – LaCivita shared comments calling January 6 an “insurrection” that was fueled by Trump’s baseless election lies. Some of those posts have since been deleted from LaCivita’s feed, but CNN was able to review them on the Internet Archive WayBack Machine, which archives internet webpages.
On January 6, 2021, LaCivita reposted several posts that harshly condemned Trump, suggesting that even some of his closest allies once viewed the deadly outcome as a direct result of Trump’s lies.
In a statement to CNN, Lacivita said his likes and retweets on January 6 were not supportive statements.
“Retweets and likes are not endorsements. I’m focused on winning the election two weeks from now, and not distractions from CNN,” he said.
LaCivita’s shared posts included a statement on January 6 from former President George W. Bush, who expressed “disbelief and dismay” at the violent assault on the Capitol, calling it “a sickening and heartbreaking sight.”
“I am appalled by the reckless behavior of some political leaders since the election and by the lack of respect shown today for our institutions, our traditions, and our law enforcement,” read the statement by Bush that LaCivita shared. “The violent assault on the Capitol – and disruption of a Constitutionally-mandated meeting of Congress – was undertaken by people whose passions have been inflamed by falsehoods and false hopes.”
The post, which was shared on the evening of January 6, was later deleted from LaCivita’s feed.
CNN also reviewed a video showing a screen recording of posts that LaCivita liked on January 6, including one from Republican former Rep. Barbara Comstock of Virginia, who called for Trump’s Cabinet to remove him from office via the 25th Amendment.
“Twitter locked @realDonaldTrump for 12 hours. Now the Cabinet needs to lock him down for the next 14 days. #25thAmendmentNow,” Comstock wrote on the evening of January 6.
Although X has since removed the ability to view likes, a user whose tweet was liked by LaCivita confirmed to CNN that his post had indeed been liked by Trump’s campaign manager on January 6.
The 25th Amendment allows the vice president and a majority of the Cabinet to declare the president unfit for office, temporarily transferring power to the vice president.
Another post shared by LaCivita was a stark message from a Republican Senate aide, which John McCormack, then a reporter for the conservative magazine National Review, shared on X.
“Text message from a GOP Senate aide: ‘This is a disgusting tragedy. Someone literally lost their life because of a lie that Trump told, Cruz/Hawley capitalized on, and fringe media echoed. This is in no way shape or form sustainable.’”
Another since-removed post from LaCivita’s feed included a comment calling those who stormed the Capitol “thugs.” The comment from a GOP political staffer linked to a CNN tweet reading, “Pro-Trump protesters have stormed the US Capitol, where members of Congress were meeting to certify President-elect Joe Biden’s win.”
“They are not protestors. They are thugs,” the post read.
The shared comments by LaCivita, the top staffer for Trump’s quest to retake the White House this November, are notable as the former president in the closing weeks of the campaign has sought to recast the events that day.
On social media, Trump has shared unfounded conspiracies suggesting the riot was an inside job perpetrated by the federal government. He has also called the rally and events preceding it as a day of “love and peace,” and suggested that if he regains the White House, he will pardon January 6 rioters convicted of violent acts that day.
During a Univision town hall last week, Trump defended his supporters’ actions, claiming they stormed the Capitol because they believed the election was “rigged.” He continued to mischaracterize the day’s events, stating, “That was a day of love from the standpoint of the millions.”
Last week, on Truth Social, Trump also shared a post calling January 6 “the day the government staged a riot.”
The unfounded conspiracy theory that the federal government staged the January 6 attack has been widely debunked as baseless.
LaCivita, a longtime Republican political strategist with a career working on high-profile campaigns throughout Virginia and nationally, has served in the role of co-campaign manager for Donald Trump’s third presidential bid with fellow seasoned political operative Susie Wiles since 2023.
He first gained national recognition during the 2004 presidential election for his role in the Swift Boat Veterans for Truth campaign, the group that sought to undermine and attack Democratic nominee John Kerry’s military record.",23/10/2024
CNN,New House speaker once partnered with so-called ‘ex-gay’ conversion group | CNN Politics,"Speaker of the House Mike Johnson closely collaborated with a group in the mid-to-late 2000s that promoted “conversion therapy,” a discredited practice that asserted it could change the sexual orientation of gay and lesbian individuals.
Prior to launching his political career, Johnson, a lawyer, gave legal advice to an organization called Exodus International and partnered with the group to put on an annual anti-gay event aimed at teens, according to a CNN KFile review of more than a dozen of Johnson’s media appearances from that timespan.
Founded in 1976, Exodus International was a leader in the so-called “ex-gay” movement, which aimed to make gay individuals straight through conversion therapy programs using religious and counseling methods. Exodus International connected ministries across the world using these controversial approaches.
The group shut down in 2013, with its founder posting a public apology for the “pain and hurt” his organization caused. Conversion therapy has been widely condemned by most major medical institutions and has been shown to be harmful to struggling LGBTQ people.
At the time, Johnson worked as an attorney for the socially conservative legal advocacy group, Alliance Defense Fund (ADF). He and his group collaborated with Exodus from 2006 to 2010.
For years, Johnson and Exodus worked on an event started by ADF in 2005 known as the “Day of Truth” – a counterprotest to the “Day of Silence,” a day in schools in which students stayed silent to bring awareness to bullying faced by LGBTQ youth.
The Day of Truth sought to counter that silence by distributing information about what Johnson described as the “dangerous” gay lifestyle.
“I mean, our race, the size of our feet, the color of our eyes, these are things we’re born with and we cannot change,” Johnson told one radio host in 2008 promoting the event. “What these adult advocacy groups like the Gay Lesbian Straight Education Network are promoting is a type of behavior. Homosexual behavior is something you do, it’s not something that you are.”
In print, radio and on television, Johnson, a Louisiana Republican, frequently disparaged homosexuality, according to KFile’s review. He advocated for the criminalization of gay sex and went so far as to partially blame it for the fall of the Roman Empire.
“Some credit to the fall of Rome to not only the deprivation of the society and the loss of morals, but also to the rampant homosexual behavior that was condoned by the society,” Johnson told a radio host in 2008.
Johnson’s office did not respond to a CNN request for comment asking about his work with Exodus.
A close collaboration
Exodus International joined ADF’s Day of Truth event in 2006 and the groups worked together on promotional material for the event, including a standalone website which pointed users to Exodus’ conversion ministries. Documents on that website cited the since-repudiated academic work in support of conversion therapy. Exodus Youth, the group’s youth wing, promoted the event within its blogs.
Videos put out by Exodus and ADF on their standalone Day of Truth website featured two Exodus staffers speaking about how teens didn’t need to “accept” or “embrace” their homosexuality. The videos featured testimonials of a “former-homosexual” and “former lesbian.”
Documents on the website were not archived online but were saved by anti-conversion therapy groups such as Truth Wins Out in 2007 and 2008. The website featured a FAQ on homosexuality provided by Exodus and sold t-shirts saying, “the Truth cannot be silenced.”
One video featured Johnson, who was later quoted in a press release on Exodus International’s website ahead of the event, saying, “An open, honest discussion allows truth to rise to the surface.”
Johnson promoted the event heavily in the media – through radio interviews, comments in newspapers, and an editorial. In interviews, he repeatedly cited the case of a teen who went to school after the Day of Silence wearing a shirt that read, “Be ashamed. Our school has embraced what God has condemned” and “Homosexuality is shameful.” The teen was suspended and ADF represented him in legal action over the incident. The case was dismissed because the teen graduated, and the court found he no longer had standing to challenge the dress code.
“Day of Truth was really established to counter the promotion of the homosexual agenda in public schools,” Johnson told a radio host in 2008.
Those who worked to counter ADF and Exodus at the time, said the event was dangerous to confused youth.
“This directly harmed LGBTQ youth,” Wayne Besen, the executive director of Truth Wins Out and an expert on the ex-gay industry, told CNN. “This is someone whose core was promoting anti-gay and ex-gay viewpoints. He wouldn’t pander to anti-gay advocates, he was the anti-gay and ex-gay advocate.”
Randy Scobey, a former executive vice president at Exodus, who worked on the Day of Truth in the organization’s collaboration with ADF, called the event one of his biggest regrets.
“It was bullying those who were trying to not be bullied,” said Scobey, who now lives openly as a gay man. “That was one of the public ways that the Alliance Defense Fund worked with us.”
Ties between Exodus and ADF extended beyond the event.
ADF, which has since changed its name to the Alliance Defending Freedom, touted Exodus International in promotional brochures in 2004, crediting it as an organization that “played an instrumental role in helping thousands of individuals come out of homosexual behavior.”
Scobey recalled Johnson as quiet, but firm in his beliefs that homosexuality was wrong. He said Johnson and ADF provided crucial legal advice to Exodus and its “member ministries.”
“We worked with them behind the scenes a lot,” Scobey told CNN, saying the group offered them legal guidance over their ex-gay counseling. “They were very important to us as far as helping us to feel more secure legally and politically.”
Exodus International stopped sponsoring the Day of Truth event in 2010, saying it became adversarial and counterproductive.
CNN’s Em Steck contributed to this report.",1/11/2023
